{
  "symbol": "BRAF",
  "name": "B-Raf proto-oncogene, serine/threonine kinase",
  "entrez_id": "673",
  "ensembl_id": "ENSG00000157764",
  "location": "7",
  "genomic_coordinates": {
    "coordinate": "7:140719327-140925199 (strand: -1)",
    "genome_build": "GRCh38",
    "source": "MyGene.info",
    "provenance": "MyGene.info provider default"
  },
  "omim_id": "164757",
  "uniprot_id": "P15056",
  "summary": "This gene encodes a protein belonging to the RAF family of serine/threonine protein kinases. This protein plays a role in regulating the MAP kinase/ERK signaling pathway, which affects cell division, differentiation, and...",
  "gene_type": "protein-coding",
  "aliases": [
    "B-RAF1",
    "BRAF1",
    "NS7",
    "RAFB1"
  ],
  "clinical_diseases": [
    "cardiofaciocutaneous syndrome",
    "Noonan syndrome",
    "melanoma",
    "Noonan syndrome with multiple lentigines",
    "cancer"
  ],
  "clinical_drugs": [
    "ENCORAFENIB",
    "VEMURAFENIB",
    "REGORAFENIB",
    "DABRAFENIB MESYLATE"
  ],
  "_meta": {
    "evidence_urls": [
      {
        "label": "NCBI Gene",
        "url": "https://www.ncbi.nlm.nih.gov/gene/673"
      },
      {
        "label": "UniProt",
        "url": "https://www.uniprot.org/uniprot/P15056"
      },
      {
        "label": "Ensembl",
        "url": "https://www.ensembl.org/Homo_sapiens/Gene/Summary?g=ENSG00000157764"
      },
      {
        "label": "OMIM",
        "url": "https://www.omim.org/entry/164757"
      }
    ],
    "next_commands": [
      "biomcp search variant -g BRAF",
      "biomcp search article -g BRAF",
      "biomcp search drug --target BRAF",
      "biomcp gene trials BRAF"
    ]
  }
}
